{
  "vct": "eu.we-build:paymentterms:1",
  "iss": "https://issuer.example.com",
  "iat": 1736935200,
  "exp": 1768471200,
  "issuing_entity": "did:example:legal-entity-456",
  "issuing_country": "DE",
  "attestation_legal_category": "EAA",
  "schema_version": "1.0",
  "trust_anchor_url": "https://trust.webuildconsortium.eu/anchors/eidas-tl",

  "payment_due": "P30D",
  "currency": "EUR",
  "incoterm": "DAP",

  "buyer_identifier": {
    "euid": "DE1212.HRB123456",
    "tax": "DE123456789"
  },

  "supplier_identifier": {
    "lei": "724500PM3I5IXFKXK422"
  },

  "agreement_date": "2025-01-10",
  "payment_reference_event": "invoice_date",
  "contract_reference": "PO-2025-00123",
  "transaction_amount": 250000.00,
  "delivery_location": "Hauptstraße 12, 10115 Berlin, Germany",

  "status": {
    "type": "status-list",
    "status_list_credential": "https://issuer.example.com/status/paymentterms/2025",
    "status_list_index": 789,
    "status_purpose": "revocation"
  },

  "cnf": {
    "jwk": {
      "kty": "EC",
      "crv": "P-256",
      "x": "TCAER19Zvu3OHF4j4W4vfSVoHIP1ILilDls7vCeGemc",
      "y": "ZxjiWWbZMQGHVWKVQ4hbSIirsVfuecCE6t4jT9F2HZQ"
    }
  }
}